{"duration_ms":1000,"events":[{"at_ms":500,"key":"boke.smile","role":"boke"},{"at_ms":500,"key":"tsukkomi.retort","role":"tsukkomi"}],"id":"paper-theater-scene-plan-b4f3322815820f2d77b2","intent":"evaluation","kind":"paper-theater-scene-plan","roles":{"boke":{"character_ref":"boke@v001","initial_key":"boke.neutral","license_status":"approved","package_id":"variant-export-package-aaaaaaaaaaaaaaaaaaaa","package_manifest_path":"variant-export-package-aaaaaaaaaaaaaaaaaaaa/package-manifest.json","package_manifest_sha256":"cccccccccccccccccccccccccccccccccccccccccccccccccccccccccccccccc","stage_slot":"left","variant_set_ref":"variant-set-aaaaaaaaaaaaaaaaaaaa"},"tsukkomi":{"character_ref":"tsukkomi@v001","initial_key":"tsukkomi.neutral","license_status":"approved","package_id":"variant-export-package-bbbbbbbbbbbbbbbbbbbb","package_manifest_path":"variant-export-package-bbbbbbbbbbbbbbbbbbbb/package-manifest.json","package_manifest_sha256":"dddddddddddddddddddddddddddddddddddddddddddddddddddddddddddddddd","stage_slot":"right","variant_set_ref":"variant-set-bbbbbbbbbbbbbbbbbbbb"}},"schema_version":"1.0","segments":[{"boke":{"key":"boke.neutral","png_path":"variant-export-package-aaaaaaaaaaaaaaaaaaaa/variants/v1/boke-neutral.png","png_sha256":"aaaaaaaaaaaaaaaaaaaaaaaaaaaaaaaaaaaaaaaaaaaaaaaaaaaaaaaaaaaaaaaa","variant_id":"variant-11111111111111111111"},"end_ms":500,"stage_slots":{"boke":"left","tsukkomi":"right"},"start_ms":0,"tsukkomi":{"key":"tsukkomi.neutral","png_path":"variant-export-package-bbbbbbbbbbbbbbbbbbbb/variants/v1/tsukkomi-neutral.png","png_sha256":"bbbbbbbbbbbbbbbbbbbbbbbbbbbbbbbbbbbbbbbbbbbbbbbbbbbbbbbbbbbbbbbb","variant_id":"variant-33333333333333333333"}},{"boke":{"key":"boke.smile","png_path":"variant-export-package-aaaaaaaaaaaaaaaaaaaa/variants/v1/boke-smile.png","png_sha256":"aaaaaaaaaaaaaaaaaaaaaaaaaaaaaaaaaaaaaaaaaaaaaaaaaaaaaaaaaaaaaaaa","variant_id":"variant-22222222222222222222"},"end_ms":1000,"stage_slots":{"boke":"left","tsukkomi":"right"},"start_ms":500,"tsukkomi":{"key":"tsukkomi.retort","png_path":"variant-export-package-bbbbbbbbbbbbbbbbbbbb/variants/v1/tsukkomi-retort.png","png_sha256":"bbbbbbbbbbbbbbbbbbbbbbbbbbbbbbbbbbbbbbbbbbbbbbbbbbbbbbbbbbbbbbbb","variant_id":"variant-44444444444444444444"}}]}
